{"approval_ref":"synthetic-approval-not-trusted","grant_id":"synthetic-grant","grant_version":"v1","grant_hash":"sha256:0000000000000000000000000000000000000000000000000000000000000000","decision":"APPROVE","approved_by":"human","approver_id":"synthetic-person-not-authenticated","approved_at":"2026-09-03T07:05:00Z"}
